{
  "schema_version": "forecast_spatial_diagnostics_v1",
  "generated_at": "2026-07-18T10:55:50Z",
  "rule_version": "forecast_spatial_diagnostics_candidate_v1_20260718",
  "rule_status": "preregistered_before_spatial_metric_evaluation",
  "truth_access": "forbidden",
  "truth_accessed": false,
  "may_change_meteorological_risk": false,
  "diagnostics": [
    {
      "id": "20200501_00_024:SA-09:spatial-v1",
      "case_id": "20200501_00_024",
      "region_id": "SA-09",
      "hazard": "heavy_rain",
      "initial_time": "2020-05-01T00:00:00Z",
      "valid_start_time": "2020-05-01T00:00:00Z",
      "valid_end_time": "2020-05-02T00:00:00Z",
      "lead_time_hours": 24,
      "risk_level": "low",
      "risk_score": 0.0,
      "grid_cell_count": 22,
      "precip_spatial_p95_mm": 1.51291,
      "risk_json_p95_mm": 1.51291,
      "precip_spatial_p99_mm": 1.58828,
      "precip_spatial_max_mm": 1.605429,
      "area_fraction_ge_medium": 0.0,
      "area_fraction_ge_high": 0.0,
      "top_5pct_precip_share": 0.112478,
      "p99_to_p95_ratio": 1.049818,
      "precip_weighted_elevation_m": 528.06,
      "precip_share_above_1000m": 0.214203,
      "precip_elevation_correlation": 0.541538,
      "candidate_triggered": false,
      "candidate_conflict_flag": "none",
      "candidate_attention_level": "routine",
      "candidate_status": "preregistered_before_spatial_metric_evaluation",
      "may_change_meteorological_risk": false,
      "rationale_zh": "未触发预注册局地热点条件。",
      "source_file": "handoff/mazu_like/mazu_like_20200501_00_lead024.nc",
      "source_sha256": "9d37a0f948c52de3b7257b569b105d6f7960240d109baebd28b1aa8b99e6435b"
    },
    {
      "id": "20200501_00_048:SA-09:spatial-v1",
      "case_id": "20200501_00_048",
      "region_id": "SA-09",
      "hazard": "heavy_rain",
      "initial_time": "2020-05-01T00:00:00Z",
      "valid_start_time": "2020-05-02T00:00:00Z",
      "valid_end_time": "2020-05-03T00:00:00Z",
      "lead_time_hours": 48,
      "risk_level": "low",
      "risk_score": 0.0,
      "grid_cell_count": 22,
      "precip_spatial_p95_mm": 2.898325,
      "risk_json_p95_mm": 2.8983252,
      "precip_spatial_p99_mm": 3.170239,
      "precip_spatial_max_mm": 3.231235,
      "area_fraction_ge_medium": 0.0,
      "area_fraction_ge_high": 0.0,
      "top_5pct_precip_share": 0.133541,
      "p99_to_p95_ratio": 1.093818,
      "precip_weighted_elevation_m": 603.61,
      "precip_share_above_1000m": 0.27142,
      "precip_elevation_correlation": 0.735755,
      "candidate_triggered": false,
      "candidate_conflict_flag": "none",
      "candidate_attention_level": "routine",
      "candidate_status": "preregistered_before_spatial_metric_evaluation",
      "may_change_meteorological_risk": false,
      "rationale_zh": "未触发预注册局地热点条件。",
      "source_file": "handoff/mazu_like/mazu_like_20200501_00_lead048.nc",
      "source_sha256": "80c6fc83d2658e22ed2989f0878c5175ad3ef8949b65af4e7c76946062b37bf1"
    },
    {
      "id": "20200501_00_072:SA-09:spatial-v1",
      "case_id": "20200501_00_072",
      "region_id": "SA-09",
      "hazard": "heavy_rain",
      "initial_time": "2020-05-01T00:00:00Z",
      "valid_start_time": "2020-05-03T00:00:00Z",
      "valid_end_time": "2020-05-04T00:00:00Z",
      "lead_time_hours": 72,
      "risk_level": "low",
      "risk_score": 0.0,
      "grid_cell_count": 22,
      "precip_spatial_p95_mm": 2.643829,
      "risk_json_p95_mm": 2.6438292,
      "precip_spatial_p99_mm": 4.538558,
      "precip_spatial_max_mm": 5.027789,
      "area_fraction_ge_medium": 0.045617,
      "area_fraction_ge_high": 0.0,
      "top_5pct_precip_share": 0.289307,
      "p99_to_p95_ratio": 1.716661,
      "precip_weighted_elevation_m": 691.891,
      "precip_share_above_1000m": 0.310356,
      "precip_elevation_correlation": 0.518502,
      "candidate_triggered": false,
      "candidate_conflict_flag": "none",
      "candidate_attention_level": "routine",
      "candidate_status": "preregistered_before_spatial_metric_evaluation",
      "may_change_meteorological_risk": false,
      "rationale_zh": "未触发预注册局地热点条件。",
      "source_file": "handoff/mazu_like/mazu_like_20200501_00_lead072.nc",
      "source_sha256": "82c68459c554d6175db7112e8940e278a1a332c477ca9fec707bd92ab9f8f338"
    },
    {
      "id": "20200505_00_024:SA-09:spatial-v1",
      "case_id": "20200505_00_024",
      "region_id": "SA-09",
      "hazard": "heavy_rain",
      "initial_time": "2020-05-05T00:00:00Z",
      "valid_start_time": "2020-05-05T00:00:00Z",
      "valid_end_time": "2020-05-06T00:00:00Z",
      "lead_time_hours": 24,
      "risk_level": "low",
      "risk_score": 0.0,
      "grid_cell_count": 22,
      "precip_spatial_p95_mm": 2.966485,
      "risk_json_p95_mm": 2.9664848,
      "precip_spatial_p99_mm": 3.05441,
      "precip_spatial_max_mm": 3.075433,
      "area_fraction_ge_medium": 0.0,
      "area_fraction_ge_high": 0.0,
      "top_5pct_precip_share": 0.090401,
      "p99_to_p95_ratio": 1.02964,
      "precip_weighted_elevation_m": 507.786,
      "precip_share_above_1000m": 0.211036,
      "precip_elevation_correlation": 0.633274,
      "candidate_triggered": false,
      "candidate_conflict_flag": "none",
      "candidate_attention_level": "routine",
      "candidate_status": "preregistered_before_spatial_metric_evaluation",
      "may_change_meteorological_risk": false,
      "rationale_zh": "未触发预注册局地热点条件。",
      "source_file": "handoff/mazu_like/mazu_like_20200505_00_lead024.nc",
      "source_sha256": "bfbc3ba79e55b7452d252c17b50a769bd4d0bbeb819d764f33f19e0cbd271fde"
    },
    {
      "id": "20200505_00_048:SA-09:spatial-v1",
      "case_id": "20200505_00_048",
      "region_id": "SA-09",
      "hazard": "heavy_rain",
      "initial_time": "2020-05-05T00:00:00Z",
      "valid_start_time": "2020-05-06T00:00:00Z",
      "valid_end_time": "2020-05-07T00:00:00Z",
      "lead_time_hours": 48,
      "risk_level": "high",
      "risk_score": 7.0,
      "grid_cell_count": 22,
      "precip_spatial_p95_mm": 12.604136,
      "risk_json_p95_mm": 12.604136,
      "precip_spatial_p99_mm": 13.067808,
      "precip_spatial_max_mm": 13.168055,
      "area_fraction_ge_medium": 0.500009,
      "area_fraction_ge_high": 0.181979,
      "top_5pct_precip_share": 0.107659,
      "p99_to_p95_ratio": 1.036787,
      "precip_weighted_elevation_m": 553.93,
      "precip_share_above_1000m": 0.231521,
      "precip_elevation_correlation": 0.65193,
      "candidate_triggered": false,
      "candidate_conflict_flag": "none",
      "candidate_attention_level": "routine",
      "candidate_status": "preregistered_before_spatial_metric_evaluation",
      "may_change_meteorological_risk": false,
      "rationale_zh": "未触发预注册局地热点条件。",
      "source_file": "handoff/mazu_like/mazu_like_20200505_00_lead048.nc",
      "source_sha256": "835c1267edd4a7897046c5a30ff8096798d3358588620377aa33bd9b61dd3f10"
    },
    {
      "id": "20200505_00_072:SA-09:spatial-v1",
      "case_id": "20200505_00_072",
      "region_id": "SA-09",
      "hazard": "heavy_rain",
      "initial_time": "2020-05-05T00:00:00Z",
      "valid_start_time": "2020-05-07T00:00:00Z",
      "valid_end_time": "2020-05-08T00:00:00Z",
      "lead_time_hours": 72,
      "risk_level": "medium",
      "risk_score": 5.0,
      "grid_cell_count": 22,
      "precip_spatial_p95_mm": 6.930152,
      "risk_json_p95_mm": 6.9301516,
      "precip_spatial_p99_mm": 10.436749,
      "precip_spatial_max_mm": 11.34923,
      "area_fraction_ge_medium": 0.181979,
      "area_fraction_ge_high": 0.045617,
      "top_5pct_precip_share": 0.178084,
      "p99_to_p95_ratio": 1.505991,
      "precip_weighted_elevation_m": 560.791,
      "precip_share_above_1000m": 0.221909,
      "precip_elevation_correlation": 0.502333,
      "candidate_triggered": false,
      "candidate_conflict_flag": "none",
      "candidate_attention_level": "routine",
      "candidate_status": "preregistered_before_spatial_metric_evaluation",
      "may_change_meteorological_risk": false,
      "rationale_zh": "未触发预注册局地热点条件。",
      "source_file": "handoff/mazu_like/mazu_like_20200505_00_lead072.nc",
      "source_sha256": "8d88a90fa58c00496ff7553e4ad44bbbfdd13ea63eaddc339e0fed69a372dadd"
    },
    {
      "id": "20200515_00_024:SA-09:spatial-v1",
      "case_id": "20200515_00_024",
      "region_id": "SA-09",
      "hazard": "heavy_rain",
      "initial_time": "2020-05-15T00:00:00Z",
      "valid_start_time": "2020-05-15T00:00:00Z",
      "valid_end_time": "2020-05-16T00:00:00Z",
      "lead_time_hours": 24,
      "risk_level": "low",
      "risk_score": 0.0,
      "grid_cell_count": 22,
      "precip_spatial_p95_mm": 2.143346,
      "risk_json_p95_mm": 2.1433459,
      "precip_spatial_p99_mm": 2.764261,
      "precip_spatial_max_mm": 2.926786,
      "area_fraction_ge_medium": 0.0,
      "area_fraction_ge_high": 0.0,
      "top_5pct_precip_share": 0.157792,
      "p99_to_p95_ratio": 1.289694,
      "precip_weighted_elevation_m": 723.88,
      "precip_share_above_1000m": 0.365185,
      "precip_elevation_correlation": 0.903274,
      "candidate_triggered": false,
      "candidate_conflict_flag": "none",
      "candidate_attention_level": "routine",
      "candidate_status": "preregistered_before_spatial_metric_evaluation",
      "may_change_meteorological_risk": false,
      "rationale_zh": "未触发预注册局地热点条件。",
      "source_file": "handoff/mazu_like/mazu_like_20200515_00_lead024.nc",
      "source_sha256": "95252072ebc8a43961e250b2899fd1a49f4434313a14dc61b7eb5aedcc688355"
    },
    {
      "id": "20200515_00_048:SA-09:spatial-v1",
      "case_id": "20200515_00_048",
      "region_id": "SA-09",
      "hazard": "heavy_rain",
      "initial_time": "2020-05-15T00:00:00Z",
      "valid_start_time": "2020-05-16T00:00:00Z",
      "valid_end_time": "2020-05-17T00:00:00Z",
      "lead_time_hours": 48,
      "risk_level": "low",
      "risk_score": 0.0,
      "grid_cell_count": 22,
      "precip_spatial_p95_mm": 2.245214,